{
  "generated": "2026-10-12 21:17 UTC",
  "scanned": 40,
  "errors": [],
  "rows": [
    {
      "ticker": "MU",
      "name": "Micron Technology, Inc.",
      "group": "AI Infrastructure / Fiber",
      "price": 989.04,
      "mktcap": 1119022743552.0,
      "counts": {
        "strong_buy": 9,
        "buy": 36,
        "hold": 3,
        "sell": 0,
        "strong_sell": 1
      },
      "n": 49,
      "consensus": "bull",
      "target_mean": 1555.1304,
      "target_high": 3000.0,
      "target_low": 361.0,
      "upside_mean": 57.2,
      "upside_high": 203.3,
      "downside_low": -63.5,
      "flags": [
        "lone_bear",
        "breakaway"
      ],
      "breaks": [
        {
          "date": "2026-10-07",
          "firm": "DA Davidson",
          "from": "Buy",
          "to": "Buy",
          "action": "main",
          "side": "bull",
          "target": 3000.0,
          "prior_target": 2100.0,
          "target_vs_mean": 92.9,
          "upside": 203.3,
          "why": "target +93% vs mean"
        },
        {
          "date": "2026-10-01",
          "firm": "Cantor Fitzgerald",
          "from": "Overweight",
          "to": "Overweight",
          "action": "reit",
          "side": "bull",
          "target": 2000.0,
          "prior_target": 2000.0,
          "target_vs_mean": 28.6,
          "upside": 102.2,
          "why": "target +29% vs mean"
        },
        {
          "date": "2026-06-25",
          "firm": "Barclays",
          "from": "Overweight",
          "to": "Overweight",
          "action": "main",
          "side": "bull",
          "target": 2000.0,
          "prior_target": 1175.0,
          "target_vs_mean": 28.6,
          "upside": 102.2,
          "why": "target +29% vs mean"
        },
        {
          "date": "2026-06-25",
          "firm": "Goldman Sachs",
          "from": "Neutral",
          "to": "Neutral",
          "action": "main",
          "side": "hold",
          "target": 1100.0,
          "prior_target": 900.0,
          "target_vs_mean": -29.3,
          "upside": 11.2,
          "why": "target -29% vs mean"
        },
        {
          "date": "2026-06-25",
          "firm": "Susquehanna",
          "from": "Positive",
          "to": "Positive",
          "action": "main",
          "side": "bull",
          "target": 2000.0,
          "prior_target": 1750.0,
          "target_vs_mean": 28.6,
          "upside": 102.2,
          "why": "target +29% vs mean"
        }
      ],
      "score": 13.7,
      "path_50": true,
      "path_50_why": "Street high target $3,000.00 is +203%",
      "novel": true,
      "times_picked": 0,
      "last_picked": null,
      "last_pick_return": null
    },
    {
      "ticker": "ORCL",
      "name": "Oracle Corporation",
      "group": "AI Leaders",
      "price": 137.39,
      "mktcap": 416497926144.0,
      "counts": {
        "strong_buy": 7,
        "buy": 28,
        "hold": 7,
        "sell": 1,
        "strong_sell": 0
      },
      "n": 43,
      "consensus": "bull",
      "target_mean": 237.97415,
      "target_high": 400.0,
      "target_low": 110.0,
      "upside_mean": 73.2,
      "upside_high": 191.1,
      "downside_low": -19.9,
      "flags": [
        "lone_bear",
        "breakaway"
      ],
      "breaks": [
        {
          "date": "2026-09-11",
          "firm": "RBC Capital",
          "from": "Sector Perform",
          "to": "Sector Perform",
          "action": "main",
          "side": "hold",
          "target": 165.0,
          "prior_target": 190.0,
          "target_vs_mean": -30.7,
          "upside": 20.1,
          "why": "target -31% vs mean"
        },
        {
          "date": "2026-09-11",
          "firm": "Guggenheim",
          "from": "Buy",
          "to": "Buy",
          "action": "reit",
          "side": "bull",
          "target": 400.0,
          "prior_target": 400.0,
          "target_vs_mean": 68.1,
          "upside": 191.1,
          "why": "target +68% vs mean"
        },
        {
          "date": "2026-09-11",
          "firm": "Stephens & Co.",
          "from": "Equal-Weight",
          "to": "Equal-Weight",
          "action": "reit",
          "side": "hold",
          "target": 175.0,
          "prior_target": 175.0,
          "target_vs_mean": -26.5,
          "upside": 27.4,
          "why": "target -26% vs mean"
        },
        {
          "date": "2026-07-20",
          "firm": "CLSA",
          "from": "",
          "to": "Hold",
          "action": "init",
          "side": "hold",
          "target": 145.0,
          "prior_target": 0.0,
          "target_vs_mean": -39.1,
          "upside": 5.5,
          "why": "target -39% vs mean"
        }
      ],
      "score": 12.7,
      "path_50": true,
      "path_50_why": "Street high target $400.00 is +191%",
      "novel": true,
      "times_picked": 0,
      "last_picked": null,
      "last_pick_return": null
    },
    {
      "ticker": "NVDA",
      "name": "NVIDIA Corporation",
      "group": "AI Leaders",
      "price": 226.32,
      "mktcap": 5464948998144.0,
      "counts": {
        "strong_buy": 10,
        "buy": 49,
        "hold": 2,
        "sell": 1,
        "strong_sell": 0
      },
      "n": 62,
      "consensus": "bull",
      "target_mean": 328.71695,
      "target_high": 515.0,
      "target_low": 180.0,
      "upside_mean": 45.2,
      "upside_high": 127.6,
      "downside_low": -20.5,
      "flags": [
        "lone_bear",
        "breakaway"
      ],
      "breaks": [
        {
          "date": "2026-08-27",
          "firm": "Evercore ISI Group",
          "from": "Outperform",
          "to": "Outperform",
          "action": "main",
          "side": "bull",
          "target": 465.0,
          "prior_target": 413.0,
          "target_vs_mean": 41.5,
          "upside": 105.5,
          "why": "target +41% vs mean"
        },
        {
          "date": "2026-08-27",
          "firm": "Raymond James",
          "from": "Strong Buy",
          "to": "Strong Buy",
          "action": "main",
          "side": "bull",
          "target": 515.0,
          "prior_target": 352.0,
          "target_vs_mean": 56.7,
          "upside": 127.6,
          "why": "target +57% vs mean"
        }
      ],
      "score": 11.3,
      "path_50": true,
      "path_50_why": "Street high target $515.00 is +128%",
      "novel": true,
      "times_picked": 0,
      "last_picked": null,
      "last_pick_return": null
    },
    {
      "ticker": "IBM",
      "name": "International Business Machines",
      "group": "Quantum / Emerging Tech",
      "price": 227.02,
      "mktcap": 213883355136.0,
      "counts": {
        "strong_buy": 3,
        "buy": 9,
        "hold": 11,
        "sell": 1,
        "strong_sell": 1
      },
      "n": 25,
      "consensus": "bull",
      "target_mean": 240.56435,
      "target_high": 297.0,
      "target_low": 174.0,
      "upside_mean": 6.0,
      "upside_high": 30.8,
      "downside_low": -23.4,
      "flags": [
        "lone_bear",
        "breakaway"
      ],
      "breaks": [
        {
          "date": "2026-07-14",
          "firm": "HSBC",
          "from": "Hold",
          "to": "Reduce",
          "action": "down",
          "side": "bear",
          "target": 191.0,
          "prior_target": 231.0,
          "target_vs_mean": -20.6,
          "upside": -15.9,
          "why": "bearish vs consensus"
        },
        {
          "date": "2026-07-14",
          "firm": "Oppenheimer",
          "from": "Outperform",
          "to": "Outperform",
          "action": "reit",
          "side": "bull",
          "target": 350.0,
          "prior_target": 320.0,
          "target_vs_mean": 45.5,
          "upside": 54.2,
          "why": "target +45% vs mean"
        },
        {
          "date": "2026-07-06",
          "firm": "B of A Securities",
          "from": "Buy",
          "to": "Buy",
          "action": "main",
          "side": "bull",
          "target": 330.0,
          "prior_target": 315.0,
          "target_vs_mean": 37.2,
          "upside": 45.4,
          "why": "target +37% vs mean"
        }
      ],
      "score": 9.8,
      "path_50": true,
      "path_50_why": "Oppenheimer target $350.00 is +54%",
      "novel": false,
      "times_picked": 1,
      "last_picked": "2026-04-15",
      "last_pick_return": -5.47
    },
    {
      "ticker": "VST",
      "name": "Vistra Corp.",
      "group": "Nuclear / Next-Gen Energy",
      "price": 158.13,
      "mktcap": 53073997824.0,
      "counts": {
        "strong_buy": 4,
        "buy": 16,
        "hold": 0,
        "sell": 0,
        "strong_sell": 1
      },
      "n": 21,
      "consensus": "bull",
      "target_mean": 210.25,
      "target_high": 305.0,
      "target_low": 106.0,
      "upside_mean": 33.0,
      "upside_high": 92.9,
      "downside_low": -33.0,
      "flags": [
        "lone_bear",
        "breakaway"
      ],
      "breaks": [
        {
          "date": "2026-07-15",
          "firm": "Scotiabank",
          "from": "Sector Outperform",
          "to": "Sector Outperform",
          "action": "main",
          "side": "bull",
          "target": 298.0,
          "prior_target": 293.0,
          "target_vs_mean": 41.7,
          "upside": 88.5,
          "why": "target +42% vs mean"
        }
      ],
      "score": 9.7,
      "path_50": true,
      "path_50_why": "Street high target $305.00 is +93%",
      "novel": false,
      "times_picked": 1,
      "last_picked": "2026-06-12",
      "last_pick_return": 9.26
    },
    {
      "ticker": "MRNA",
      "name": "Moderna, Inc.",
      "group": "Contrarian examples",
      "price": 213.74,
      "mktcap": 85332680704.0,
      "counts": {
        "strong_buy": 1,
        "buy": 4,
        "hold": 15,
        "sell": 2,
        "strong_sell": 1
      },
      "n": 23,
      "consensus": "hold",
      "target_mean": 122.66667,
      "target_high": 200.0,
      "target_low": 45.0,